{
  "$schema": "http://json-schema.org/draft-04/schema#",
  "title": "associated-branches.response",
  "type": "object",
  "description": "Response containing branches associated with a specific branch for sourcing inventory",
  "additionalProperties": false,
  "properties": {
    "errorCode": {
      "type": [
        "null",
        "string"
      ],
      "description": "Error code returned from the vendor's API, if any"
    },
    "callBackInfo": {
      "description": "Optional callback information to be used in the next request. Only present if a callback is needed",
      "oneOf": [
        {
          "type": "null"
        },
        {
          "$ref": "#/definitions/CallbackInfo"
        }
      ]
    },
    "success": {
      "type": "boolean"
    },
    "errorKind": {
      "type": [
        "null",
        "string"
      ]
    },
    "message": {
      "type": [
        "null",
        "string"
      ]
    },
    "errorMessage": {
      "type": [
        "null",
        "string"
      ]
    },
    "associatedBranches": {
      "type": "array",
      "items": {
        "$ref": "#/definitions/VendorAssociatedBranchDto"
      }
    },
    "$schema": {
      "type": "string",
      "default": "./associated-branches.response.schema.json"
    }
  },
  "definitions": {
    "CallbackInfo": {
      "type": "object",
      "additionalProperties": false,
      "properties": {
        "shouldCallback": {
          "type": "boolean",
          "description": "Controls whether another request should be made"
        },
        "values": {
          "type": [
            "null",
            "object"
          ],
          "description": "Generic object to be passed to the next request\nUsed for passing data between chained requests",
          "additionalProperties": {}
        },
        "maxCallbacksForRequest": {
          "type": [
            "integer",
            "null"
          ],
          "format": "int32"
        }
      }
    },
    "VendorAssociatedBranchDto": {
      "type": "object",
      "description": "Represents a branch that is associated with another branch for sourcing",
      "additionalProperties": false,
      "properties": {
        "branchId": {
          "type": "string"
        },
        "sourceBranchId": {
          "type": [
            "null",
            "string"
          ],
          "description": "The source branch this association belongs to. Used in bulk mode where all associations\nare returned in a single response. Null in per-branch mode (source is implicit from the request)."
        },
        "metadata": {
          "type": [
            "null",
            "object"
          ],
          "description": "Additional metadata about the association (distance, relationship type, etc.)",
          "additionalProperties": {
            "type": "string"
          }
        }
      }
    }
  }
}