{
  "errorCode": "errorCode",
  "callBackInfo": null,
  "success": false,
  "errorKind": "errorKind",
  "message": "message",
  "errorMessage": "errorMessage",
  "associatedBranches": [
    {
      "branchId": "branchId",
      "sourceBranchId": "sourceBranchId",
      "metadata": {}
    }
  ],
  "$schema": "./associated-branches.response.schema.json"
}